{
  "$schema": "https://json-schema.org/draft/2020-12/schema",
  "$id": "https://github.com/edwardjones3976/director-orchestrator/docs/schemas/model-result-packet-v1.schema.json",
  "title": "Director Model Result Packet v1",
  "type": "object",
  "additionalProperties": false,
  "required": [
    "schema_version",
    "task_id",
    "assignment_id",
    "idempotency_key",
    "authority_snapshot_digest",
    "correlation",
    "provider",
    "run_reference",
    "status",
    "outcome",
    "artifacts",
    "checks",
    "acceptance",
    "risks",
    "blockers",
    "requested_decisions",
    "side_effects",
    "revision_recommended"
  ],
  "properties": {
    "schema_version": {
      "const": "1.0"
    },
    "task_id": {
      "type": "string",
      "minLength": 1
    },
    "assignment_id": {
      "type": "string",
      "minLength": 1
    },
    "idempotency_key": {
      "type": "string",
      "minLength": 1
    },
    "authority_snapshot_digest": {
      "type": "string",
      "pattern": "^sha256:[0-9a-f]{64}$"
    },
    "correlation": {
      "type": "object",
      "additionalProperties": false,
      "required": [
        "correlation_id",
        "source_event_id"
      ],
      "properties": {
        "correlation_id": {
          "type": "string",
          "minLength": 1
        },
        "source_event_id": {
          "type": "string",
          "minLength": 1
        },
        "slack_thread_ts": {
          "type": [
            "string",
            "null"
          ]
        },
        "github_issue": {
          "type": [
            "string",
            "null",
            "object"
          ]
        },
        "github_pull_request": {
          "type": [
            "string",
            "null"
          ]
        }
      }
    },
    "provider": {
      "type": "string",
      "minLength": 1
    },
    "run_reference": {
      "type": "string",
      "minLength": 1
    },
    "status": {
      "enum": [
        "SUCCEEDED",
        "FAILED",
        "CANCELLED",
        "OWNER_DECISION_REQUIRED",
        "REVISION_REQUIRED"
      ]
    },
    "outcome": {
      "type": "string",
      "minLength": 1
    },
    "artifacts": {
      "type": "array",
      "items": {
        "type": "object",
        "additionalProperties": false,
        "required": [
          "kind",
          "location"
        ],
        "properties": {
          "kind": {
            "type": "string",
            "minLength": 1
          },
          "location": {
            "type": "string",
            "minLength": 1
          },
          "digest": {
            "type": [
              "string",
              "null"
            ],
            "pattern": "^sha256:[0-9a-f]{64}$"
          }
        }
      }
    },
    "checks": {
      "type": "array",
      "items": {
        "type": "object",
        "additionalProperties": false,
        "required": [
          "command",
          "result"
        ],
        "properties": {
          "command": {
            "type": "string",
            "minLength": 1
          },
          "result": {
            "type": "string",
            "minLength": 1
          },
          "exit_code": {
            "type": [
              "integer",
              "null"
            ]
          }
        }
      }
    },
    "acceptance": {
      "type": "array",
      "minItems": 1,
      "items": {
        "type": "object",
        "additionalProperties": false,
        "required": [
          "check",
          "status"
        ],
        "properties": {
          "check": {
            "type": "string"
          },
          "status": {
            "enum": [
              "PASS",
              "FAIL",
              "NOT_RUN",
              "BLOCKED"
            ]
          },
          "evidence": {
            "type": [
              "string",
              "null"
            ]
          }
        }
      }
    },
    "risks": {
      "type": "array",
      "items": {
        "type": "string"
      }
    },
    "blockers": {
      "type": "array",
      "items": {
        "type": "string"
      }
    },
    "requested_decisions": {
      "type": "array",
      "items": {
        "type": "string"
      }
    },
    "side_effects": {
      "type": "array",
      "items": {
        "type": "object",
        "additionalProperties": false,
        "required": [
          "kind",
          "target",
          "status",
          "idempotency_key"
        ],
        "properties": {
          "kind": {
            "type": "string",
            "minLength": 1
          },
          "target": {
            "type": "string",
            "minLength": 1
          },
          "status": {
            "enum": [
              "NOT_ATTEMPTED",
              "ATTEMPTED",
              "COMPLETED",
              "FAILED"
            ]
          },
          "idempotency_key": {
            "type": "string",
            "minLength": 1
          },
          "external_id": {
            "type": [
              "string",
              "null"
            ]
          }
        }
      }
    },
    "usage": {
      "type": [
        "object",
        "null"
      ],
      "additionalProperties": false,
      "properties": {
        "model": {
          "type": [
            "string",
            "null"
          ]
        },
        "input_tokens": {
          "type": [
            "integer",
            "null"
          ],
          "minimum": 0
        },
        "output_tokens": {
          "type": [
            "integer",
            "null"
          ],
          "minimum": 0
        },
        "total_tokens": {
          "type": [
            "integer",
            "null"
          ],
          "minimum": 0
        },
        "cost_usd": {
          "type": [
            "number",
            "null"
          ],
          "minimum": 0
        }
      }
    },
    "revision_recommended": {
      "type": "boolean"
    }
  }
}
